{"schema_version":"1","analysis_rev":"fx-0001","producer_commit":"w0-fixture","input_artifact_hashes":{},"sec":[[0,0,0,1,[]],[1,0,1,1,[]],[2,0,1,1,[]],[3,1,1,1,["E1"]],[4,1,0,1,["E1"]],[5,1,0,1,["E1","E2"]],[6,1,0,1,["E1","E2"]],[7,1,0,1,["E1"]],[8,0,0,1,[]],[9,0,0,1,[]]],"lanes":{"dashcam":[[0,10000,"ok"]]}}
