{"schema_version":"1","analysis_rev":"fx-0001","producer_commit":"w0-fixture","input_artifact_hashes":{},"sec":[[0,2,1,7,[]],[1,2,1,7,[]],[2,2,1,7,[]],[3,2,1,7,[]],[4,2,1,7,["E1","E2"]],[5,2,1,7,["E1","E2"]],[6,2,1,3,[]],[7,2,1,7,[]],[8,2,1,7,[]],[9,2,1,7,[]]],"lanes":{"ceiling_00":[[0,10000,"ok"]],"ceiling_04":[[0,120,"no_video"],[120,10000,"ok"]],"eye_00":[[0,6000,"ok"],[6000,7000,"no_video"],[7000,10000,"ok"]]}}
